{
  "schema_version": "1.0",
  "batch_id": "01a15df9-abf0-7c49-a5fd-1450695de7f9",
  "kiosk_id": "kiosk-001",
  "kiosk_t_wall": "2026-10-21T10:35:00+05:30",
  "sha256": "000000000000000000000000000000000000000000000000000000000000ba7d",
  "event_count": 210,
  "session_chunks": [
    {
      "encryption": "x25519_sealed_aes256gcm",
      "session_id": "01a15df9-9480-78bd-98a1-a021f6e0e2f9",
      "sealed_dek": "c2VhbGVkLWRlay1wbGFjZWhvbGRlcg==",
      "nonce": "bm9uY2UxMjM0NTY=",
      "ciphertext": "Y2lwaGVydGV4dA==",
      "first_seq": 0,
      "last_seq": 209,
      "event_count": 210
    }
  ]
}
